Name,Directions
['Peanut Butter Banana Smoothie'],"['Place bananas, milk, peanut butter, honey, and ice cubes in a blender; blend until smooth, about 30 seconds.']"
['All-Around Good Smoothie'],"['In a blender, blend the milk, yogurt, banana, protein supplement, flax seed, honey, and strawberries until smooth.']"
['Groovy Green Smoothie'],"['Place the banana, grapes, yogurt, apple and spinach into a blender. Cover, and blend until smooth, stopping frequently to push down anything stuck to the sides. Pour into glasses and serve.']"
['Peanut Butter and Banana Smoothie'],"['In a blender, combine banana, peanut butter and soy milk. Blend until smooth. Pour into glasses and drizzle with honey for garnish.']"
['Orange Glorious I'],"['In a blender combine milk, water, orange juice concentrate, ice cubes, vanilla and sugar. Blend until smooth. Pour into three 12 oz glasses and enjoy with a straw.']"
['Mango Lassi II'],"['In a blender, combine mangos, yogurt, sugar and ice. Blend until smooth. Pour into glasses and serve.']"
['Iced Mocha Fusion Shake'],"['In a blender or food processor, combine  milk, vanilla, sugar, coffee powder and crushed ice. Blend until smooth. Pour into glasses and serve.']"
['Purple Monstrosity Fruit Smoothie'],"['Place bananas, blueberries and  juice in a blender, puree.  Use honey and/or vanilla to taste. Use more or less liquid depending on the thickness you want for your smoothie.']"
['Banana Smoothie I'],"['In a blender, combine banana, milk, vanilla, egg and sugar. Blend until smooth. Pour into a tall glass and top with a pinch of cinnamon.']"
['Gloomy Day Smoothie'],"['Place mango, banana, orange juice, and yogurt in a blender. Blend until smooth. Serve in clear glasses, and drink with a bendy straw!']"
['Avocado Smoothie'],"['Combine the avocado, milk, yogurt, honey, and ice cubes in a blender; blend until smooth.']"
['Kale and Banana Smoothie'],"['Place the banana, kale, soy milk, flax seeds, and maple syrup into a blender. Cover, and puree until smooth. Serve over ice.']"
['Groovie Smoothie'],"['In a blender, combine bananas, frozen strawberries, yogurt and milk. Blend until smooth. Pour into glasses and serve.']"
['Triple Threat Fruit Smoothie'],"['In a blender, blend the kiwi, banana, blueberries, strawberries, ice, orange juice, and yogurt until smooth.']"
['Delicious Healthy Strawberry Shake'],"['In a blender, combine milk, honey, vanilla and frozen strawberries. Blend until smooth. Pour into glasses and serve.']"
['Mongolian Strawberry-Orange Juice Smoothie'],"['In a blender, combine strawberries, orange juice, ice cubes and sugar. Blend until smooth. Pour into glasses and serve.']"
['Orange Smoothie'],"['In a blender, combine orange juice concentrate, milk, water, vanilla, sugar and ice. Blend until smooth. Pour into glasses and serve.']"
['Heavenly Blueberry Smoothie'],"['Cut banana into small pieces and place into the bowl of a blender.  Add the soy milk, yogurt, flax seed meal, and honey.  Blend on lowest speed until smooth, about 5 seconds.  Gradually add the blueberries while continuing to blend on low.  Once the blueberries have been incorporated, increase speed, and blend to desired consistency.']"
['Easy Pasta Casserole'],"['Bring a large pot of lightly salted water to a boil. Add pasta and cook for 8 to 10 minutes or until al dente; drain and reserve.', 'Preheat oven to 350 degrees F (175 degrees C).', 'In a large skillet, brown the beef until no longer pink; drain off grease. Add spaghetti sauce, mushrooms, and tomatoes to beef and simmer for 10 minutes or until warmed through.', 'In a 9x13 inch baking dish, pour in beef and tomato mixture and add pasta; mix well. Sprinkle the cheese evenly over the top.', 'Bake in preheated oven for 20 minutes or until the cheese starts to bubble; serve immediately.']"
['Buffalo Chicken Mac and Cheese'],"['Bring a large pot of lightly salted water to a boil. Cook macaroni in the boiling water, stirring occasionally until tender yet firm to the bite, 8 minutes. Drain.', 'Cut wings and legs off rotisserie chicken. Skin and bone wings and legs; chop or shred dark meat into bite-size pieces.', 'Melt butter in a large Dutch oven over medium heat. Whisk in flour gradually until a thick paste forms. Cook until golden, about 1 minute. Pour in milk, whisking constantly, until thickened and bubbling, about 5 minutes. Continue to cook until sauce is smooth, about 1 minute more. Reduce heat and season sauce with black pepper.', 'Stir Cheddar and Monterey Jack cheese into the sauce until melted and combined. Stir in hot sauce, adjusting to reach desired level of spiciness. Add blue cheese, chicken, and macaroni; mix well to combine.']"
['Quick Fish Tacos'],"['Mix sour cream and lime juice together in a large bowl; season with salt and black pepper. Reserve about half the mixture in another bowl for serving. Mince half the jalapeno pepper; save other half for later. Toss cabbage, green onions, and minced jalapeno half in remaining sour cream mixture until slaw is well mixed.', 'Heat olive oil and remaining jalapeno half in a large skillet over medium heat; swirl oil to coat skillet evenly. Season tilapia fillets with salt and pepper. Pan-fry fish strips in the skillet in 2 batches until fish is golden brown and easily flaked with a fork, 5 to 6 minutes. Discard jalapeno half.', 'Heat tortillas in the microwave on high until warm, 20 to 30 seconds.', 'Serve fish in warmed tortillas topped with cabbage slaw, reserved sour cream mixture, and cilantro.']"
['Spatchcock Chicken'],"['Preheat oven to 450 degrees F (230 degrees C). Line a large rimmed baking sheet with foil.', 'Place chicken, breast side down, on a work surface. Starting at the tail end, cut along both sides of backbone with kitchen shears. Remove backbone. Grabbing hold of both sides of the chicken, open it like a book. Turn breast side up. Push down on each side of breast with your hands until you hear it crack. Flatten chicken and transfer to one short end of the prepared baking sheet. Repeat with the second chicken.', 'Combine salt, tarragon, paprika, and pepper in a small bowl. Stir in oil. Run your fingers under chicken skin and rub tarragon paste under skin. Slide lemon slices under skin, in a single layer.', 'Roast until skin is crisp and an instant-read thermometer inserted into thickest part of breast reads 165 degrees F, about 35 minutes. Let stand 5 minutes before cutting each chicken into 8 pieces.']"
['Deviled Lobster Tails'],"['Mix mayonnaise, tarragon, sriracha sauce, paprika, lemon juice, cayenne pepper, and salt together in a bowl.', ""Preheat oven to 500 degrees F (260 degrees C). Set oven rack about 8 inches from the heat source and preheat the oven's broiler."", 'Loosen lobster meat from the shell, leaving it attached near the tip of the tail. Place tails on a baking sheet lined with crinkled aluminum foil to help keep them in place.', 'Spoon some of the mayonnaise mixture beneath the lobster meat and spread a generous amount on top.', 'Broil in the preheated oven until lobster tails are browned and cooked through, 5 to 7 minutes.']"
['Skillet Chicken Bulgogi'],"['Whisk onion, soy sauce, brown sugar, garlic, sesame oil, sesame seeds, cayenne pepper, salt, and black pepper together in a bowl until marinade is smooth.', 'Cook and stir chicken and marinade together in a large skillet over medium-high heat until chicken is cooked through, about 15 minutes.']"
['Lasagna Flatbread'],"['Preheat oven to 375 degrees F (190 degrees C).', 'Combine ricotta cheese, 1/2 of the mozzarella cheese, Parmesan cheese, egg, and Italian seasoning in a bowl.', 'Cook sausage in a skillet over medium heat until no longer pink, 5 to 10 minutes; drain. Stir in marinara sauce.', 'Spread 1/6 of the cheese mixture evenly on each flatbread; cover with sausage mixture. Top with remaining mozzarella cheese.', 'Bake in the preheated oven until cheese is melted and bubbly, 10 to 15 minutes.']"
"[""Andie's Quick 'n Easy Sneaky Sloppy Joes""]","['Place lentils in a small pot and cover with 2 cups hot water. Bring to a boil; reduce heat and simmer until lentils are tender, about 15 minutes. Drain.', 'Heat a large nonstick skillet over medium heat. Add onions; cook and stir until softened, 3 to 5 minutes. Add ground beef and green bell pepper; cook and stir until browned, about 8 minutes.', 'Stir drained lentils, ketchup, barbeque sauce, Worcestershire sauce, and minced garlic into the skillet. Reduce heat to low and simmer until flavors combine and mixture thickens to desired consistency, 15 to 20 minutes.']"
['Speckled Trout in Capers and White Wine'],"['Preheat oven to 400 degrees F (200 degrees C). Line a baking dish with aluminum foil.', 'Place trout in the middle of the aluminum foil; top with butter, lemon pepper, capers, and paprika. Pour cooking wine over trout. Close foil around the trout.', 'Bake in the preheated oven until fish flakes easily with a fork, about 30 minutes. Garnish trout with parsley.']"
['Salsa Chicken'],"['Preheat oven to 375  degrees F (190 degrees C)', 'Place chicken breasts in a lightly greased 9x13 inch baking dish. Sprinkle taco seasoning on both sides of chicken breasts, and pour salsa over all.', 'Bake at 375 degrees F (190 degrees C) for 25 to 35 minutes, or until chicken is tender and juicy and its juices run clear.', 'Sprinkle chicken evenly with cheese, and continue baking for an additional 3 to 5 minutes, or until cheese is melted and bubbly. Top with sour cream if desired, and serve.']"
['Marinated Grilled Shrimp'],"['In a large bowl, stir together the garlic, olive oil, tomato sauce, and red wine vinegar. Season with basil, salt, and cayenne pepper. Add shrimp to the bowl, and stir until evenly coated. Cover, and refrigerate for 30 minutes to 1 hour, stirring once or twice.', 'Preheat grill for medium heat. Thread shrimp onto skewers, piercing once near the tail and once near the head. Discard marinade.', 'Lightly oil grill grate. Cook shrimp on preheated grill for 2 to 3 minutes per side, or until opaque.']"
['Famous Butter Chicken'],"['Preheat oven to 375  degrees F (190 degrees C).', 'Place eggs and cracker crumbs in two separate shallow bowls. Mix cracker crumbs with garlic salt and pepper. Dip chicken in the eggs, then dredge in the crumb mixture to coat.', 'Arrange coated chicken in a 9x13 inch baking dish. Place pieces of butter around the chicken.', 'Bake in the preheated oven for 40 minutes, or until chicken is no longer pink and juices run clear.']"
['Spicy Garlic Lime Chicken'],"['In a small bowl, mix together salt, black pepper, cayenne, paprika, 1/4 teaspoon garlic powder, onion powder, thyme and parsley. Sprinkle spice mixture generously on both sides of chicken breasts.', 'Heat butter and olive oil in a large heavy skillet over medium heat. Saute chicken until golden brown, about 6 minutes on each side. Sprinkle with 2 teaspoons garlic powder and lime juice. Cook 5 minutes more, stirring frequently to coat evenly with sauce.']"
['Hamburger Steak with Onions and Gravy'],"['In a large bowl, mix together the ground beef, egg, bread crumbs, pepper, salt, onion powder, garlic powder, and Worcestershire sauce. Form into 8 balls, and flatten into patties.', 'Heat the oil in a large skillet over medium heat. Fry the patties and onion in the oil until patties are nicely browned, about 4 minutes per side. Remove the beef patties to a plate, and keep warm.', 'Sprinkle flour over the onions and drippings in the skillet. Stir in flour with a fork, scraping bits of beef off of the bottom as you stir. Gradually mix in the beef broth and sherry. Season with seasoned salt. Simmer and stir over medium-low heat for about 5 minutes, until the gravy thickens. Turn heat to low, return patties to the gravy, cover, and simmer for another 15 minutes.']"
['Baked Honey Mustard Chicken'],"['Preheat oven to 350 degrees F (175 degrees C).', 'Sprinkle chicken breasts with salt and pepper to taste, and place in a lightly greased 9x13 inch baking dish. In a small bowl, combine the honey, mustard, basil, paprika, and parsley. Mix well. Pour 1/2 of this mixture over the chicken, and brush to cover.', 'Bake in the preheated oven for 30 minutes. Turn chicken pieces over and brush with the remaining 1/2 of the honey mustard mixture. Bake for an additional 10 to 15 minutes, or until chicken is no longer pink and juices run clear. Let cool 10 minutes before serving.']"
['Lime Chicken Soft Tacos'],"['Saute chicken in a medium saucepan over medium high heat for about 20 minutes. Add vinegar, lime juice, sugar, salt, pepper, green onion, garlic and oregano. Simmer for an extra 10 minutes.', 'Heat an iron skillet over medium heat.  Place a tortilla in the pan, warm, and turn over to heat the other side. Repeat with remaining tortillas. Serve lime chicken mixture in warm tortillas topped with tomato, lettuce, cheese and salsa.']"
['Honey Mustard Grilled Chicken'],"['Preheat the grill for medium heat.', 'In a shallow bowl, mix the mustard, honey, mayonnaise, and steak sauce. Set aside a small amount of the honey mustard sauce for basting, and dip the chicken into the remaining sauce to coat.', 'Lightly oil the grill grate. Grill chicken over indirect heat for 18 to 20 minutes, turning occasionally, or until juices run clear. Baste occasionally with the reserved sauce during the last 10 minutes. Watch carefully to prevent burning!']"
['Chicken Milano'],"['In a large saucepan over low heat, melt butter; add garlic and cook for 30 seconds. Add the tomatoes and 3/4 cup of the chicken broth; increase to medium heat and bring to a boil. Reduce heat and simmer, uncovered, for about 10 minutes or until the tomatoes are tender. Add the cream and bring to a boil; stirring. Simmer over medium heat until the sauce is thick enough to coat the back of a spoon.', 'Sprinkle the chicken with salt and pepper on both sides. In a large skillet over medium heat, warm oil and saute chicken. Press on chicken occasionally with a slotted spatula. Cook for about 4 minutes per side or until the meat feels springy and is no longer pink inside. Transfer to a board; cover and keep warm. Discard the fat from the skillet.', 'In the same skillet, over medium heat, bring 1/4 cup chicken broth to a boil; stirring the pan juices. Reduce slightly and add to the cream sauce; stir in basil and adjust seasonings to taste.', 'Meanwhile, bring a large pot of lightly salted water to a boil. Add fettuccine and cook for 8 to 10  minutes or until al dente; drain, transfer to a bowl and toss with 3 to 4 tablespoons of the sauce.', 'Cut each chicken breast into 2 to 3 diagonal slices. Reheat the sauce gently if needed. Transfer the pasta to serving plates; top with chicken and coat with the cream sauce; serve.']"
['Shrimp Scampi Bake'],"['Preheat oven to 450 degrees F (230 degrees C).', 'In a small saucepan over medium heat, combine the butter, mustard, lemon juice, garlic, and parsley. When the butter melts completely, remove from heat.', 'Arrange shrimp in a shallow baking dish. Pour the butter mixture over the shrimp.', 'Bake in preheated oven for 12 to 15 minutes or until the shrimp are pink and opaque.']"
['Chicken Cordon Bleu I'],"['Preheat oven to 350 degrees F (175 degrees C).  Coat a 7x11 inch baking dish with nonstick cooking spray.', 'Pound chicken breasts to 1/4 inch thickness.', 'Sprinkle each piece of chicken on both sides with salt and pepper.  Place 1 cheese slice and 1 ham slice on top of each breast. Roll up each breast, and secure with a toothpick.  Place in baking dish, and sprinkle chicken evenly with bread crumbs.', 'Bake for 30 to 35 minutes, or until chicken is no longer pink. Remove from oven, and place 1/2 cheese slice on top of each breast.  Return to oven for 3 to 5 minutes, or until cheese has melted. Remove toothpicks, and serve immediately.']"
['Easy Mexican Casserole'],"['Preheat oven to 350 degrees F (175 degrees C).', 'In a large skillet over medium-high heat, cook ground beef until no longer pink. Stir in salsa, reduce heat, and simmer 20 minutes, or until liquid is absorbed. Stir in beans, and heat through.', 'Spray a 9x13 baking dish with cooking spray. Spread crushed tortilla chips in dish, and then spoon beef mixture over chips. Spread sour cream over beef, and sprinkle olives, green onion, and tomato over the sour cream. Top with Cheddar cheese.', 'Bake in preheated oven for 30 minutes, or until hot and bubbly.']"
['Easy Garlic Broiled Chicken'],"['Preheat the oven broiler. Lightly grease a baking pan.', 'In a microwave safe bowl, mix the butter, garlic, soy sauce, pepper, and parsley. Cook 2 minutes on High in the microwave, or until butter is melted.', 'Arrange chicken on the baking pan, and coat with the butter mixture, reserving some of the mixture for basting.', 'Broil chicken 20 minutes in the preheated oven, until juices run clear, turning occasionally and basting with remaining butter mixture. Sprinkle with parsley to serve.']"
['Chinese Chicken Fried Rice II'],"['In a small bowl, beat egg with water. Melt butter in a large skillet over medium low heat. Add egg and leave flat for 1 to 2 minutes. Remove from skillet and cut into shreds.', 'Heat oil in same skillet; add onion and saute until soft. Then add rice, soy sauce, pepper and chicken. Stir fry together for about 5 minutes, then stir in egg. Serve hot.']"
['Mushroom Pork Chops'],"['Season pork chops with salt, pepper, and garlic salt to taste.', 'In a large skillet, brown the chops over medium-high heat. Add the onion and mushrooms, and saute for one minute. Pour cream of mushroom soup over chops. Cover skillet, and reduce temperature to medium-low. Simmer 20 to 30 minutes, or until chops are cooked through.']"
['Taco Pie'],"['Preheat oven to 350 degrees F (175 degrees C).', 'Lay crescent dough flat on the bottom of a square cake pan and bake according to package directions.', 'Meanwhile, brown the ground beef in a large skillet over medium high heat. Add the taco seasoning and stir together well. When dough is done, remove from oven and place meat mixture on top, then layer with sour cream and cheese, and then top off with the crushed nacho chips.', 'Return to oven and bake at 350 degrees F (175 degrees C) for 10 minutes, or until cheese has melted.']"
['The Best Parmesan Chicken Bake'],"['Preheat oven to 350 degrees F (175 degrees C).', 'Coat the bottom of a 9x13 inch casserole dish with olive oil, and sprinkle with garlic and hot red pepper flakes.', 'Arrange the chicken breasts in bottom of the dish, and pour marinara sauce over chicken. Sprinkle basil over marinara sauce, and top with half the mozzarella cheese, followed by half the Parmesan cheese. Sprinkle on the croutons, then top with the remaining mozzarella cheese and remaining Parmesan cheese.', 'Bake in preheated oven until cheese and croutons are golden brown and the chicken is no longer pink inside, about 35 minutes to an hour, depending on the shape and thickness of your chicken breasts. An instant-read thermometer inserted into the thickest part of a chicken breast should read at least 160 degrees F (70 degrees C).']"
['Baked Chicken Nuggets'],"['Preheat oven to 400 degrees F (200 degrees C).', 'Cut chicken breasts into 1 1/2-inch sized pieces. In a medium bowl, mix together the bread crumbs, cheese, salt, thyme and basil. Mix well. Put melted butter in a bowl or dish for dipping.', 'Dip chicken pieces into the melted butter first, then coat with the breadcrumb mixture. Place the well-coated chicken pieces on a lightly greased cookie sheet in a single layer, and bake in the preheated oven for 20 minutes.']"
['A Good Easy Garlic Chicken'],"['Melt butter in a large skillet over medium high heat. Add chicken and sprinkle with garlic powder, seasoning salt and onion powder. Saute about 10 to 15 minutes on each side, or until chicken is cooked through and juices run clear.']"
['Easy Tuna Casserole'],"['Preheat oven to 350 degrees F (175 degrees C).', 'In a 9x13-inch baking dish, combine the macaroni, tuna, and soup. Mix well, and then top with cheese.', 'Bake at 350 degrees F (175 degrees C) for about 25 minutes, or until bubbly. Sprinkle with fried onions, and bake for another 5 minutes. Serve hot.']"
['Slow Cooker Apple Cider Braised Pork'],"['Season pork with salt and black pepper. Heat oil in a large skillet over high heat. Sear pork on all sides in the hot oil until browned, about 3 minutes per side. Transfer pork to the slow cooker.', 'Reduce stovetop temperature to medium; cook and stir shallots and celery in the skillet until they begin to soften, 3 to 4 minutes. Pour in apple cider vinegar and cook, scraping up any browned bits, until liquid is nearly evaporated, 4 to 5 minutes.', 'Pour shallot mixture over pork shoulder in the slow cooker. Add apple cider, garlic cloves, and bay leaf. Cover, set slow cooker to Low, and cook until fork-tender but not falling apart, about 6 hours. Turn pork over every 1  to 2 hours. Remove pork roast to a plate and cover loosely with foil.', 'Pour remaining liquid from the slow cooker through a fine mesh strainer into a large saucepan; place over high heat. Discard bay leaf and other solids. Bring sauce mixture to a boil, decrease heat and cook, skimming fat from the top, until reduced to 1/4 of the original volume, about 10 minutes.', 'Remove sauce from heat and stir in Dijon mustard and cayenne pepper. Slowly whisk in cold butter until incorporated. Sprinkle in fresh herbs and season with salt and black pepper to taste.', 'Cut pork into 1/4-thick slices and serve with sauce poured over the top.']"
['Slow Cooker Mediterranean Beef with Artichokes'],"['Heat oil in a large pot over medium-high heat. Cook beef in the hot oil until browned, about 2 minutes per side.', 'Transfer beef to a slow cooker. Cover with artichoke hearts, onion, and garlic. Pour in beef broth, tomato sauce, and diced tomatoes. Stir in olives, oregano, parsley, basil, cumin, bay leaf.', 'Cook on Low until beef is tender, about 7 hours.']"
['BBQ Beef Brisket Sandwiches'],"['Mix celery salt, black pepper, salt, garlic salt, and onion salt in a small bowl; add Worcestershire sauce. Spread mixture over beef brisket; transfer to a slow cooker.', 'Cook on Low until beef is tender, about 8 hours.', 'Transfer beef to a cutting board; shred into small pieces using 2 forks.', 'Measure 1/2 cup cooking liquid from the slow cooker into a saucepan. Mix in Russian dressing and barbeque sauce; bring to a boil.', 'Combine shredded beef and sauce mixture in the slow cooker. Cook on Low until flavors combine, about 1 hour.']"
['Barbacoa-Style Shredded Beef'],"['Season beef chunks with salt and pepper on all sides.', 'Heat oil in a large skillet over medium-high heat. Add beef in batches; cook until browned, about 1 minute per side. Transfer beef to a slow cooker.', 'Combine beef broth, apple cider vinegar, lime juice, chipotle peppers, garlic, cumin, oregano, and cloves in a bowl. Season with salt and pepper and mix well. Pour over beef in the slow cooker. Stir in bay leaves.', 'Cook on Low until beef is fork-tender, 8 to 10 hours.', 'Discard bay leaves. Remove beef and shred using 2 forks. Return beef to the slow cooker to marinate in the sauce for at least 10 more minutes before serving.']"
['Busy Day Slow Cooker Taco Soup'],"['Heat a large skillet over medium-high heat. Cook and stir beef in the hot skillet until browned and crumbly, 5 to 7 minutes.', 'Stir browned ground beef, tomatoes, kidney beans, pinto beans, corn, taco seasoning, and ranch dressing mix together in the crock of a slow cooker.', 'Cook on Low for at least 3 hours.']"
['Clean Eating - Refried Beans'],"['Place beans in a slow cooker and cover with 8 cups water; soak for 8 to 10 hours.', 'Drain and rinse beans and return to slow cooker; top with 8 cups fresh water.', 'Cook beans on Low for 8 to 10 hours. Drain.', 'Combine 1/2 cup water, beans, olive oil, salt, and pepper in a skillet over medium heat; mash beans to desired consistency.']"
['Kefir Yogurt (Sana)'],"['Preheat a yogurt maker or slow cooker on Low.', 'Whisk milk and dry milk powder together in a saucepan over medium heat until almost boiling, about 4 minutes. Cool milk to lukewarm (100 to 110 degrees F/38 to 45 degrees C).', 'Gently stir kefir into milk mixture until just blended. Pour mixture into yogurt containers or slow cooker. Cook on Low', 'Cook on Low until desired level of tartness and yogurt consistency is reached, 4 to 10 hours. Chill yogurt in the refrigerator, at least 2 hours.']"
"[""Papa Funk's Campfire Chili""]","['Break ground beef and sausage into small pieces and put into the crock of a large slow cooker; add tomato sauce, dark red kidney beans, roma tomatoes, celery, green bell pepper, light red kidney beans, white kidney beans, beer, sweet onion, red bell pepper, tomato paste, green chile peppers, chili powder, chipotle peppers, adobo sauce, cumin, and barbeque sauce.', 'Cook on Low for 8 hours.']"
['Simple Slow-Cooked Korean Beef Soft Tacos'],"['Put chuck roast into the crock of a slow cooker; add onion, brown sugar, soy sauce, garlic, jalapeno pepper, ginger root, rice vinegar, sesame oil, salt, and pepper.', 'Cook on High for 8 hours (or on Low for 10 hours). Shred meat with a pair of forks and stir into the liquid in the slow cooker.', 'Serve with corn tortillas and your favorite toppings.']"
['Awesome Slow Cooker Pot Roast'],"['In a slow cooker, mix cream of mushroom soup, dry onion soup mix and water. Place pot roast in slow cooker and coat with soup mixture.', 'Cook on High setting for 3 to 4 hours, or on Low setting for 8 to 9 hours.']"
['Slow Cooker Chicken and Dumplings'],"['Place the chicken, butter, soup, and onion in a slow cooker, and fill with enough water to cover.', 'Cover, and cook for 5 to 6 hours on High. About 30 minutes before serving, place the torn biscuit dough in the slow cooker. Cook until the dough is no longer raw in the center.']"
