Name,Directions
['Carnitas - Pressure Cooker'],"['Trim excess fat from pork butt; cut pork into 2-inch cubes and transfer to a bowl.', 'Combine salt, oregano, cumin, black pepper, chile powder, and paprika together in a bowl. Rub pork cubes with spice mixture. Coat seasoned pork cubes lightly in olive oil; place in pressure cooker. Cover pork cubes with orange juice, onion, and garlic.', 'Place lid on pressure cooker and lock; bring to full pressure over medium heat until pork is no longer pink in the center, about 60 minutes. Let pressure come down naturally, about 15 minutes.', 'Remove pork from pressure cooker and shred meat.']"
['Agua Fresca de Pepino (Cucumber Limeade)'],"['Blend 2 cups water, cucumbers, lime juice, and 2 tablespoons sweetener together in a blender until smooth. Pour into pitcher; add remaining water. Stir in additional sweetener to taste.']"
['Drowned Beef Sandwich with Chipotle Sauce (Torta Ahogada)'],"['Combine chipotle cooking sauce, beef broth, and 1/4 cup chopped cilantro in a saucepan; bring to a boil. Reduce heat to medium-low and simmer, stirring occasionally, for 10 minutes.', 'Heat oil in a skillet over medium-high heat; saute onion until softened, about 5 minutes. Stir garlic into onion and cook for 1 minute. Add roast beef and 1/4 cup chipotle sauce mixture and cook, stirring constantly, until heated through, about 2 minutes.', 'Ladle remaining chipotle sauce mixture into 4 bowls for dipping. Spoon roast beef mixture onto the bottom half of each bun, top with a cilantro sprig, and place the top on each bun. Dip sandwiches into sauce.']"
['Secret Salsa'],"['Mix parsley, cilantro, lime juice, salt, garlic powder, chili powder, black pepper, and tequila together in a bowl. Add tomatoes, onion, and green bell peppers and toss to coat. Refrigerate.']"
['Easy Chicken Flautas'],"['Melt butter in a skillet over medium heat; stir flour into butter until smooth. Add onion to flour-butter mixture; cook and stir until onion is softened, 5 to 10 minutes. Mix black olives, lemon juice, oil, paprika, black pepper, and salt into onion mixture; cook and stir until heated through, about 2 minutes. Stir chicken into mixture and remove skillet from heat and cover.', 'Heat oil in a large, heavy saucepan or deep-fryer.', 'Fill tortillas with chicken mixture. Roll tortilla around filling and secure with a toothpick.', 'Fry the rolled tortillas, working in batches, in the hot oil until browned, about 2 minutes. Transfer fried tortillas to a paper towel-lined plate using a slotted spoon or tongs.']"
['Easy Mexican Sopes'],"['Whisk masa harina and salt together; stir enough water into mixture until dough is smooth and holds together. Form dough into 2-inch balls. Flatten each ball to a 1/2-inch thick circle.', 'Heat oil to 400 degrees F (200 degrees C) in a deep-fryer or large saucepan.', ""Fry dough in the hot oil until sopes are just lightly browned, about 30 seconds per side. Remove sopes with tongs and place on a paper towel-lined plate; cool just until sopes can be handled. Pinch the edges of each sope together forming little 'boats'. Return to hot oil and fry until golden and cooked through, 1 to 2 minutes.""]"
['Jalapeno and Cucumber Margarita'],"['Stir tequila, lime juice, orange liqueur, and simple syrup together in a pitcher with a lid; add jalapeno pepper and thin cucumber slices. Refrigerate at least 1 hour.', 'Run a wedge of lime along the rim of each of four pint glasses. Spread kosher salt onto a flat plate; press glass rims into salt to coat. Fill glass with ice and pour margarita over the ice. Garnish with cucumber slice.']"
['Slow Cooker Chicken Taco Soup'],"['Place the onion, chili beans, black beans, corn, tomato sauce, beer, and diced tomatoes in a slow cooker. Add taco seasoning, and stir to blend. Lay chicken breasts on top of the mixture, pressing down slightly until just covered by the other ingredients. Set slow cooker for low heat, cover, and cook for 5 hours.', 'Remove chicken breasts from the soup, and allow to cool long enough to be handled. Stir the shredded chicken back into the soup, and continue cooking for 2 hours. Serve topped with shredded Cheddar cheese, a dollop of sour cream, and crushed tortilla chips, if desired.']"
['Guacamole'],"['In a medium bowl, mash together the avocados, lime juice, and salt. Mix in onion, cilantro, tomatoes, and garlic. Stir in cayenne pepper. Refrigerate 1 hour for best flavor, or serve immediately.']"
['Taco Seasoning I'],"['In a small bowl, mix together chili powder, garlic powder, onion powder, red pepper flakes, oregano, paprika, cumin, salt and pepper. Store in an airtight container.']"
['Slow-Cooker Chicken Tortilla Soup'],"['Place chicken, tomatoes, enchilada sauce, onion, green chiles, and garlic into a slow cooker. Pour in water and chicken broth, and season with cumin, chili powder, salt, pepper, and bay leaf. Stir in corn and cilantro. Cover, and cook on Low setting for 6 to 8 hours or on High setting for 3 to 4 hours.', 'Preheat oven to 400 degrees F (200 degrees C).', 'Lightly brush both sides of tortillas with oil. Cut tortillas into strips, then spread on a baking sheet.', 'Bake in preheated oven until crisp, about 10 to 15 minutes. To serve, sprinkle tortilla strips over soup.']"
['Salsa Chicken'],"['Preheat oven to 375  degrees F (190 degrees C)', 'Place chicken breasts in a lightly greased 9x13 inch baking dish. Sprinkle taco seasoning on both sides of chicken breasts, and pour salsa over all.', 'Bake at 375 degrees F (190 degrees C) for 25 to 35 minutes, or until chicken is tender and juicy and its juices run clear.', 'Sprinkle chicken evenly with cheese, and continue baking for an additional 3 to 5 minutes, or until cheese is melted and bubbly. Top with sour cream if desired, and serve.']"
"[""Annie's Fruit Salsa and Cinnamon Chips""]","['In a large bowl, thoroughly mix kiwis, Golden Delicious apples, raspberries, strawberries, white sugar, brown sugar and fruit preserves. Cover and chill in the refrigerator at least 15 minutes.', 'Preheat oven to 350 degrees F (175 degrees C).', 'Coat one side of each flour tortilla with butter flavored cooking spray. Cut into wedges and arrange in a single layer on a large baking sheet. Sprinkle wedges with desired amount of cinnamon sugar. Spray again with cooking spray.', 'Bake in the preheated oven 8 to 10 minutes. Repeat with any remaining tortilla wedges. Allow to cool approximately 15 minutes. Serve with chilled fruit mixture.']"
['Chicken Enchiladas II'],"['Preheat oven to 350 degrees F (175 degrees C). Lightly grease a large baking dish.', 'In a medium saucepan over medium heat, melt the butter and saute the green onion until tender (about 3 to 4 minutes). Add the garlic powder, then stir in the green chiles, cream of mushroom soup and sour cream. Mix well. Reserve 3/4 of this sauce and set aside. To the remaining 1/4 of the sauce in the saucepan, add the chicken and 1/2 cup of shredded Cheddar cheese. Stir together.', 'Fill each flour tortilla with the chicken mixture and roll up. Place seam side down in the prepared baking dish.', 'In a small bowl combine the reserved 3/4 of the sauce with the milk. Spoon this mixture over the rolled tortillas and top with the remaining 1/2 cup of shredded Cheddar cheese. Bake in the preheated oven for 30 to 35 minutes, or until cheese is bubbly.']"
['Burrito Pie'],"['Preheat oven to 350 degrees F (175 degrees C).', 'In a large skillet over medium heat, saute the ground beef for 5 minutes. Add the onion and garlic, and saute for 5 more minutes. Drain any excess fat, if desired. Mix in the olives, green chile peppers, tomatoes with green chile peppers, taco sauce and refried beans. Stir mixture thoroughly, reduce heat to low, and let simmer for 15 to 20 minutes.', 'Spread a thin layer of the meat mixture in the bottom of a 4 quart casserole dish. Cover with a layer of tortillas followed by more meat mixture, then a layer of cheese. Repeat tortilla, meat, cheese pattern until all the tortillas are used, topping off with a layer of meat mixture and cheese.', 'Bake for 20 to 30 minutes in the preheated oven, or until cheese is slightly brown and bubbly.']"
['Mexican Rice II'],"['Heat oil in a large saucepan over medium heat and add rice.  Cook, stirring constantly, until puffed and golden.  While rice is cooking, sprinkle with salt and cumin.', 'Stir in onions and cook until tender.  Stir in tomato sauce and chicken broth; bring to a boil.  Reduce heat to low, cover and simmer for 20 to 25 minutes.  Fluff with a fork.']"
['Chicken Enchiladas I'],"['Preheat oven to 350 degrees F (175 degrees C).', 'In a medium, non-stick skillet over medium heat, cook chicken until no longer pink and juices run clear. Drain excess fat. Cube the chicken and return it to the skillet. Add the onion, sour cream, Cheddar cheese, parsley, oregano and ground black pepper. Heat until cheese melts. Stir in salt, tomato sauce, water, chili powder, green pepper and garlic.', 'Roll even amounts of the mixture in the tortillas. Arrange in a 9x13 inch baking dish. Cover with taco sauce and 3/4 cup Cheddar cheese. Bake uncovered in the preheated oven 20 minutes. Cool 10 minutes before serving.']"
"[""Angela's Awesome Enchiladas""]","['Place the chicken in a large pot and add water to cover. Bring to a boil over high heat, then reduce the heat to medium-low, cover, and simmer until the chicken pieces are no longer pink, about 10 minutes. Shred chicken by placing two forks back to back and pulling meat apart. Set the shredded chicken aside. Meanwhile, combine the cream of chicken soup, sour cream, and chili powder in a saucepan. Bring to a simmer over low heat, stirring occasionally, then turn off the heat and cover to keep warm.', 'Heat the butter in a skillet over medium heat. Stir in the onion; cook and stir until the onion has softened and turned translucent, about 5 minutes. Add the shredded chicken, chopped green chilies, taco seasoning, half of the bunch of chopped green onion, and water. Allow to simmer for 10 minutes. Stir in the lime juice, onion powder, and garlic powder; simmer for an additional 10 minutes.', 'Preheat an oven to 350 degrees F (175 degrees C). Stir 1 cup of the soup mixture into the skillet with the chicken mixture. Spread the remaining soup mixture on the bottom of a 9x13 inch baking dish.', 'Fill each tortilla with chicken mixture. Sprinkle Cheddar cheese over the chicken filling before folding the tortillas, reserving half of the shredded cheese for topping the enchiladas.  Fold tortillas over the filling and place seam-side down in the prepared pan.', 'Pour enchilada sauce evenly over the enchiladas. Cover with the remaining 1 1/2 cups of Cheddar cheese. Sprinkle the reserved chopped green onions and the sliced olives on top of the cheese. Bake in the preheated oven until filling is heated through and the cheese is melted and bubbling, about 25 minutes.']"
['Addictive Sweet Potato Burritos'],"['Preheat oven to 350 degrees F (175 degrees C).', 'Heat oil in a medium skillet and saute onion and garlic until soft. Mash beans into the onion mixture. Gradually stir in water; heat until warm, 2 to 3 minutes. Remove from heat and stir in the soy sauce, chili powder, mustard, cumin, and cayenne pepper.', 'Divide bean mixture and mashed sweet potatoes evenly between the tortillas; top with cheese. Fold tortillas burrito-style around the fillings and place on a baking sheet.', 'Bake in the preheated oven until warmed through, about 12 minutes.']"
['Seven Layer Taco Dip'],"['In a medium bowl, blend the taco seasoning mix and refried beans. Spread the mixture onto a large serving platter.', 'Mix the sour cream and cream cheese in a medium bowl. Spread over the refried beans.', 'Top the layers with salsa. Place a layer of tomato, green bell pepper, green onions and lettuce over the salsa, and top with Cheddar cheese. Garnish with black olives.']"
['Lime Chicken Soft Tacos'],"['Saute chicken in a medium saucepan over medium high heat for about 20 minutes. Add vinegar, lime juice, sugar, salt, pepper, green onion, garlic and oregano. Simmer for an extra 10 minutes.', 'Heat an iron skillet over medium heat.  Place a tortilla in the pan, warm, and turn over to heat the other side. Repeat with remaining tortillas. Serve lime chicken mixture in warm tortillas topped with tomato, lettuce, cheese and salsa.']"
['Fish Tacos'],"[""To make beer batter:  In a large bowl, combine flour, cornstarch, baking powder, and salt. Blend egg and beer, then quickly stir into the flour mixture (don't worry about a few lumps)."", 'To make white sauce:  In a medium bowl, mix together yogurt and mayonnaise. Gradually stir in fresh lime juice until consistency is slightly runny. Season with jalapeno, capers, oregano, cumin, dill, and cayenne.', 'Heat oil in deep-fryer to 375 degrees F (190 degrees C).', 'Dust fish pieces lightly with flour. Dip into beer batter, and fry until crisp and golden brown. Drain on paper towels. Lightly fry tortillas; not too crisp. To serve, place fried fish in a tortilla, and top with shredded cabbage, and white sauce.']"
['Refried Beans Without the Refry'],"['Place the onion, rinsed beans, jalapeno, garlic, salt, pepper, and cumin into a slow cooker. Pour in the water and stir to combine.  Cook on High for 8 hours, adding more water as needed.  Note: if more than 1 cup of water has evaporated during cooking, then the temperature is too high.', 'Once the beans have cooked, strain them, and reserve the liquid.  Mash the beans with a potato masher, adding the reserved water as needed to attain desired consistency.']"
"[""Catherine's Spicy Chicken Soup""]","['In a large pot over medium heat, combine water, chicken, salt, pepper, garlic powder, parsley, onion powder and bouillon cubes.  Bring to a boil, then reduce heat and simmer 1 hour, or until chicken juices run clear.  Remove chicken, reserve broth.  Shred chicken.', 'In a large pot over medium heat, cook onion and garlic in olive oil until slightly browned.  Stir in salsa, diced tomatoes, whole tomatoes, tomato soup, chili powder, corn, chili beans, sour cream, shredded chicken and 5 cups broth.  Simmer 30 minutes.']"
['Mexican Bean Salad'],"['In a large bowl, combine beans, bell peppers, frozen corn, and red onion.', 'In a small bowl, whisk together olive oil, red wine vinegar, lime juice, lemon juice, sugar, salt, garlic, cilantro, cumin, and black pepper.  Season to taste with hot sauce and chili powder.', 'Pour olive oil dressing over vegetables; mix well.  Chill thoroughly, and serve cold.']"
['Chicken Tortilla Soup V'],"['In a large pot over medium heat, cook and stir chicken in the oil for 5 minutes. Add the garlic and cumin and mix well. Then add the broth, corn, onion, chili powder, lemon juice, and salsa. Reduce heat to low and simmer for about 20 to 30 minutes.', 'Break up some tortilla chips into individual bowls and pour soup over chips. Top with the Monterey Jack cheese and a little sour cream.']"
['Sopapilla Cheesecake Pie'],"['Preheat an oven to 350 degrees F (175 degrees C). Prepare a 9x13 inch baking dish with cooking spray.', 'Beat the cream cheese with 1 cup of sugar and the vanilla extract in a bowl until smooth.', 'Unroll the cans of crescent roll dough, and use a rolling pin to shape each piece into 9x13 inch rectangles. Press one piece into the bottom of a 9x13 inch baking dish. Evenly spread the cream cheese mixture into the baking dish, then cover with the remaining piece of crescent dough. Stir together 3/4 cup of sugar, cinnamon, and butter. Dot the mixture over the top of the cheesecake.', 'Bake in the preheated oven until the crescent dough has puffed and turned golden brown, about 30 minutes. Remove from the oven and drizzle with honey. Cool completely in the pan before cutting into 12 squares.']"
['Memphis Rub'],"['In a small airtight container, mix paprika, dark brown sugar, white sugar, salt, monosodium glutamate, celery salt, ground black pepper, cayenne pepper, dry mustard, garlic powder and onion powder. Seal and store in a cool dark place until ready for use.']"
['Cajun Crab Cakes (No Breadcrumbs)'],"['Melt butter in a large, heavy skillet over medium heat. Stir in onion; cook and stir until the onion has softened and turned translucent, about 5 minutes.', 'Stir in the celery, bell pepper, green onion, carrot, and garlic. Continue to cook and stir until vegetables are tender, about 10 minutes more.', 'Season with 1 tablespoon parsley flakes, 2 teaspoons Creole seasoning, basil, pepper, dill weed, oregano, and thyme. Cook and stir until fragrant, 5 minutes more.', 'Transfer cooked vegetables to a large bowl; allow to cool for about 10 minutes. Set skillet aside for later use.', 'Stir the beaten eggs into the vegetables. Mix in the crabmeat and cracker crumbs with your hands, making sure not to break up the chunks of crab too much.', 'Shape the crab mixture into 12 small cakes.', 'Heat vegetable oil in the skillet over medium high heat.', 'Pan-fry the crab cakes in batches until golden brown on each side, about 3 minutes.', 'To make dipping sauce: Whisk together the mayonnaise, chile-garlic sauce, 2 teaspoon Creole seasoning, 2 teaspoon parsley flakes, and paprika.']"
['Blackened Catfish and Spicy Rice'],"['Bring the rice, water, Cajun seasoning, and hot pepper sauce to a boil in a saucepan. Reduce heat to medium-low, cover, and simmer until the rice is tender, and the liquid has been absorbed, 20 to 25 minutes.', 'While rice is cooking, mix thyme, black pepper, cayenne pepper, salt, garlic powder, onion powder, paprika, dill weed, and lemon pepper in a bowl until well blended. Brush catfish fillets with butter and sprinkle with seasoning mixture other both sides.', 'Heat any remaining melted butter in a large skillet over medium-high heat; pan-fry seasoned catfish in butter until fish is easily flaked with a fork, 4 to 5 minutes per side.', 'Serve catfish over a plate of seasoned rice. Pour leftover butter from the skillet over fish and sprinkle with lemon juice.']"
['Easy Southern Fried Green Tomatoes'],"['Line a baking sheet with waxed paper.', 'Beat eggs and water in a shallow bowl. Place flour and cornmeal in 2 separate shallow bowls. Season cornmeal with salt and pepper.', 'Dip each tomato slice into flour, then dip into egg mixture. Press tomato into cornmeal mixture, shaking off excess. Transfer tomato to prepared baking sheet. Repeat with remaining tomato slices, arranging tomatoes in a single layer.', 'Heat about 1/4 inch canola oil in a large skillet over medium heat until oil begins to shimmer. Fry tomatoes in batches until golden and crisp, 3 to 4 minutes per side. Drain on paper towel-lined plates. Repeat with remaining tomatoes.']"
['North Carolina Pulled Pork'],"['Preheat slow cooker on Low for 15 minutes.', 'Season pork shoulder with salt and pepper; place pork in preheated slow cooker. Mix ketchup, brown sugar, and vinegar in a bowl; pour over pork.', 'Cook on Low for 8 hours. Transfer pork to a large platter and slice into 3 to 4 pieces. Shred meat with 2 forks and return to slow cooker. Continue to cook for 1 hour.']"
['Carolina Mustard Sauce #1'],"['Stir mustard, honey, vinegar, ketchup, brown sugar, Worcestershire sauce, and hot pepper sauce together in a non-reactive bowl; pour into jars and seal tightly.', 'Refrigerate sauce to let the flavors blend before using, at least 24 hours.']"
['Key West Shrimp Boil with Key Lime Mustard Sauce'],"['Stir mayonnaise, lime juice, Dijon mustard, sugar, and hot pepper sauce together in a bowl until smooth; season with salt and pepper.', 'Cover bowl with plastic wrap and refrigerate mustard sauce for at least 2 hours.', 'Mix beer, lemon juice, seafood seasoning, hot pepper sauce, garlic, cayenne pepper, and black pepper together in a saucepan; bring to a boil and add shrimp. Cook shrimp just until they are bright pink on the outside and the meat is no longer transparent in the center, about 2 minutes; drain immediately.']"
['Memphis BBQ Pork Totchos'],"['Preheat oven to 425 degrees F (220 degrees C). Arrange potato nuggets in a single layer on a baking sheet.', ""Bake in the preheated oven for 20 minutes. Shake baking sheet and continue baking until potato nuggets are extra crispy, 20 to 24 minutes longer. Remove baking sheet from oven and turn on oven's broiler."", 'Top potato nuggets with pepperjack cheese, pulled pork, onion, and jalapeno peppers. Drizzle barbeque sauce over ""totchos"".', 'Broil in the preheated oven until cheese starts to bubble, 5 to 7 minutes. Top ""totchos"" with coleslaw and green onions.']"
['Grilled Peach Bourbon Smash'],"['Preheat an outdoor grill for medium-high heat and lightly oil the grate. When the grill is hot, close lid and allow to heat, 5 minutes.', 'Place peach halves and lemon, cut-side down, in sugar until coated. Place on the grill; cook until fruits are soft, about 5 minutes. Cool on a cutting board, about 1 minute. Cut peach into slices with a knife; reserve 2 for garnish.', 'Place remaining peach, mint leaves, and simple syrup into a cocktail shaker; juice lemon into the shaker. Gently muddle with a cocktail muddler. Pour in bourbon and ice, cover, and shake until the outside of the shaker has frosted. Strain into a chilled glass; top off with ginger ale, and garnish with grilled peach slices and lemon.']"
"[""Grandmother's Buttermilk Cornbread""]","['Preheat oven to 375 degrees F (175 degrees C). Grease an 8 inch square pan.', 'Melt butter in large skillet. Remove from heat and stir in sugar. Quickly add eggs and beat until well blended. Combine buttermilk with baking soda and stir into mixture in pan. Stir in cornmeal, flour, and salt until well blended and few lumps remain. Pour batter into the prepared pan.', 'Bake in the preheated oven for 30 to 40 minutes, or until a toothpick inserted in the center comes out clean.']"
['Fresh Southern Peach Cobbler'],"['Preheat oven to 425 degrees F (220 degrees C).', 'In a large bowl, combine peaches, 1/4 cup  white sugar, 1/4 cup brown sugar, 1/4 teaspoon cinnamon, nutmeg, lemon juice, and cornstarch. Toss to coat evenly, and pour into a 2 quart baking dish. Bake in preheated oven for 10 minutes.', 'Meanwhile, in a large bowl, combine flour, 1/4 cup white sugar, 1/4 cup brown sugar, baking powder, and salt. Blend in butter with your fingertips, or a pastry blender, until mixture resembles coarse meal. Stir in water until just combined.', 'Remove peaches from oven, and drop spoonfuls of topping over them. Sprinkle entire cobbler with the sugar and cinnamon mixture. Bake until topping is golden, about 30 minutes.']"
['Sweet Dinner Rolls'],"['Place water, milk, egg, 1/3 cup butter, sugar, salt, flour and yeast in the pan of the bread machine in the order recommended by the manufacturer. Select Dough/Knead and First Rise Cycle; press Start.', 'When cycle finishes, turn dough out onto a lightly floured surface. Divide dough in half. Roll each half into a 12 inch circle, spread 1/4 cup softened butter over entire round. Cut each circle into 8 wedges. Roll wedges starting at wide end; roll gently but tightly. Place point side down on ungreased cookie sheet. Cover with clean kitchen towel and put in a warm place, let rise 1 hour. Meanwhile, preheat oven to 400 degrees F (200 degrees C).', 'Bake in preheated oven for 10 to 15 minutes, until golden.']"
['Sweet Potato Pie I'],"['Boil sweet potato whole in skin for 40 to 50 minutes, or until done.  Run cold water over the sweet potato, and remove the skin.', 'Break apart sweet potato in a bowl.  Add butter, and mix well with mixer. Stir in sugar, milk, eggs, nutmeg, cinnamon and vanilla. Beat on medium speed until mixture is smooth.  Pour filling into an unbaked pie crust.', 'Bake at 350 degrees F (175 degrees C) for 55 to 60 minutes, or until knife inserted in center comes out clean.  Pie will puff up like a souffle, and then will sink down as it cools.']"
"[""Colleen's Slow Cooker Jambalaya""]","['In a slow cooker, mix the chicken, sausage, tomatoes with juice, onion, green bell pepper, celery, and broth. Season with oregano, parsley, Cajun seasoning, cayenne pepper, and thyme.', 'Cover, and cook 7 to 8 hours on Low, or 3 to 4 hours on High. Stir in the shrimp during the last 30 minutes of cook time.']"
['Spicy Bean Salsa'],"['In a medium bowl, combine black-eyed peas, black beans, corn, onion, green bell pepper, jalapeno peppers and tomatoes. Season with Italian-style salad dressing and garlic salt; mix well. Cover, and refrigerate overnight to blend flavors.']"
['Key West Chicken'],"['In a shallow container, blend soy sauce, honey, vegetable oil, lime juice, and garlic. Place chicken breast halves into the mixture, and turn to coat. Cover, and marinate in the refrigerator at least 30 minutes.', 'Preheat an outdoor grill for high heat.', 'Lightly oil the grill grate. Discard marinade, and grill chicken 6 to 8 minutes on each side, until juices run clear.']"
['Smooth Sweet Tea'],"['Sprinkle a pinch of baking soda into a 64-ounce, heat-proof, glass pitcher. Pour in boiling water, and add tea bags. Cover, and allow to steep for 15 minutes.', 'Remove tea bags, and discard; stir in sugar until dissolved. Pour in cool water, then refrigerate until cold.']"
"[""Kickin' Collard Greens""]","['Heat oil in a large pot over medium-high heat. Add bacon, and cook until crisp. Remove bacon from pan, crumble and return to the pan.  Add onion, and cook until tender, about 5 minutes.  Add garlic, and cook until just fragrant. Add collard greens, and fry until they start to wilt.', 'Pour in chicken broth, and season with salt, pepper, and red pepper flakes. Reduce heat to low, cover, and simmer for 45 minutes, or until greens are tender.']"
