Name,Directions
['Zucchini Boats on the Grill'],"['Prepare the grill for indirect heat.', 'Place the zucchini in a pot with enough water to cover. Bring to a boil, and cook 5 minutes. Drain, cool, and cut in half lengthwise. Scoop out the pulp to about 1/4 inch from the skin. Chop pulp.', 'In a bowl, mix the zucchini pulp, bread pieces, bacon bits, olives, jalapeno, green chile peppers, onion, tomato, and Cheddar cheese. Season with basil, seasoned salt, and pepper.', 'Stuff the zucchini halves with the pulp mixture. Seal each stuffed half in aluminum foil.', 'Place foil packets on the prepared grill over indirect heat. Cook 15 to 20 minutes, until tender.']"
['Steamed Broccoli and Carrots with Lemon'],"['Place a steamer insert into a saucepan and fill with water to just below the bottom of the steamer. Bring water to a boil. Add broccoli florets and carrots, cover, and steam until tender, about 5 minutes.', 'Transfer vegetables to a bowl; add lemon juice and seasoned salt and toss to coat.']"
['Thai Beef'],"['Place flank steak in the freezer for 20 minutes.', 'Whisk coriander, brown sugar, soy sauce, lime juice, garlic, and ground ginger together in a bowl until marinade is well combined.', 'Remove steak from freezer and slice thinly across the grain. Place steak in a large bowl, pour marinade over steak, and toss to coat. Cover bowl and marinate at room temperature for 1 hour.', ""Set oven rack about 6 inches from the heat source and preheat the oven's broiler. Line bottom of a broiler pan with foil."", 'Lay steak slices in a single layer on the rack of the prepared broiler pan.', 'Cook in the preheated broiler, brushing occasionally with marinade, until steak reaches desired doneness, 1 to 2 minutes for medium rare.']"
['Chicken with Ginger Pesto'],"['Pour the white wine into a saucepan of lightly salted water, and place the chicken breasts into the pan. Bring the pan to a boil, reduce the heat, and simmer the chicken until cooked through and white, 8 to 10 minutes. Remove from the heat, and let the chicken cool in the broth. Remove from the broth, and set the chicken aside.', 'Heat the vegetable oil in a skillet over medium-low heat, and stir in the ginger, garlic, salt, and sugar. Reduce heat to low, and cook, stirring occasionally, until the garlic is browned and soft, and the oil is flavored, about 20 minutes. Stir in the green onions, and cook for another 10 minutes, stirring occasionally, until the white parts of the onions are soft.', 'Slice the poached chicken breasts on the bias into slices about 1 inch wide, and arrange attractively on a plate. Spoon the green onion mixture over the chicken breasts, and serve.']"
['Grilled Pineapple Slices'],"['Preheat a grill for medium heat. When the grill is hot, lightly oil the grate.', 'Place the coconut milk and cinnamon sugar into separate dishes. Dip slices of pineapple into coconut milk, then coat in cinnamon sugar.', 'Grill slices for 6 minutes on each side. Remove to plates, and serve.']"
['Quinoa and Black Beans'],"['Heat oil in a saucepan over medium heat; cook and stir onion and garlic until lightly browned, about 10 minutes.', 'Mix quinoa into onion mixture and cover with vegetable broth; season with cumin, cayenne pepper, salt, and pepper. Bring the mixture to a boil. Cover, reduce heat, and simmer until quinoa is tender and broth is absorbed, about 20 minutes.', 'Stir frozen corn into the saucepan, and continue to simmer until heated through, about 5 minutes; mix in the black beans and cilantro.']"
['Braised Balsamic Chicken'],"['Season both sides of chicken breasts with garlic salt and pepper.', 'Heat olive oil in a skillet over medium heat; cook seasoned chicken breasts until chicken is browned, 3 to 4 minutes per side. Add onion; cook and stir until onion is browned, 3 to 4 minutes.', 'Pour diced tomatoes and balsamic vinegar over chicken; season with basil, oregano, rosemary and thyme. Simmer until chicken is no longer pink and the juices run clear, about 15 minutes. An instant-read thermometer inserted into the center should read at least 165 degrees F (74 degrees C).']"
['Fluffy French Toast'],"['Measure flour into a large mixing bowl. Slowly whisk in the milk. Whisk in the salt, eggs, cinnamon, vanilla extract and sugar until smooth.', 'Heat a lightly oiled griddle or frying pan over medium heat.', 'Soak bread slices in mixture until saturated. Cook bread on each side until golden brown. Serve hot.']"
['Roasted Brussels Sprouts'],"['Preheat oven to 400 degrees F (205 degrees C).', 'Place trimmed Brussels sprouts, olive oil, kosher salt, and pepper in a large resealable plastic bag. Seal tightly, and shake to coat. Pour onto a baking sheet, and place on center oven rack.', 'Roast in the preheated oven for 30 to 45 minutes, shaking pan every 5 to 7 minutes for even browning. Reduce heat when necessary to prevent burning. Brussels sprouts should be darkest brown, almost black, when done. Adjust seasoning with kosher salt, if necessary. Serve immediately.']"
['Homemade Black Bean Veggie Burgers'],"['If grilling, preheat an outdoor grill for high heat, and lightly oil a sheet of aluminum foil. If baking, preheat oven to 375 degrees F (190 degrees C), and lightly oil a baking sheet.', 'In a medium bowl, mash black beans with a fork until thick and pasty.', 'In a food processor, finely chop bell pepper, onion, and garlic. Then stir into mashed beans.', 'In a small bowl, stir together egg, chili powder, cumin, and chili sauce.', 'Stir the egg mixture into the mashed beans. Mix in bread crumbs until the mixture is sticky and holds together. Divide mixture into four patties.', 'If grilling, place patties on foil, and grill about 8 minutes on each side. If baking, place patties on baking sheet, and bake about 10 minutes on each side.']"
['Amazing Pork Tenderloin in the Slow Cooker'],"['Place pork tenderloin in a slow cooker with the contents of the soup packet. Pour water, wine, and soy sauce over the top, turning the pork to coat. Carefully spread garlic over the pork, leaving as much on top of the roast during cooking as possible. Sprinkle with pepper, cover, and cook on low setting for 4 hours. Serve with cooking liquid on the side as au jus.']"
['Szechwan Shrimp'],"['In a bowl, stir together water, ketchup, soy sauce, cornstarch, honey, crushed red pepper, and ground ginger. Set aside.', 'Heat oil in a large skillet over medium-high heat. Stir in green onions and garlic; cook 30 seconds. Stir in shrimp, and toss to coat with oil. Stir in sauce. Cook and stir until sauce is bubbly and thickened.']"
['Baked Honey Mustard Chicken'],"['Preheat oven to 350 degrees F (175 degrees C).', 'Sprinkle chicken breasts with salt and pepper to taste, and place in a lightly greased 9x13 inch baking dish. In a small bowl, combine the honey, mustard, basil, paprika, and parsley. Mix well. Pour 1/2 of this mixture over the chicken, and brush to cover.', 'Bake in the preheated oven for 30 minutes. Turn chicken pieces over and brush with the remaining 1/2 of the honey mustard mixture. Bake for an additional 10 to 15 minutes, or until chicken is no longer pink and juices run clear. Let cool 10 minutes before serving.']"
['Roasted Garlic Cauliflower'],"['Preheat the oven to 450 degrees F (220 degrees C). Grease a large casserole dish.', 'Place the olive oil and garlic in a large resealable bag. Add cauliflower, and shake to mix. Pour into the prepared casserole dish, and season with salt and pepper to taste.', 'Bake for 25 minutes, stirring halfway through. Top with Parmesan cheese and parsley, and broil for 3 to 5 minutes, until golden brown.']"
"[""Sarah's Applesauce""]","['In a saucepan, combine apples, water, sugar, and cinnamon. Cover, and cook over medium heat for 15 to 20 minutes, or until apples are soft. Allow to cool, then mash with a fork or potato masher.']"
['Ginger Glazed Mahi Mahi'],"['In a shallow glass dish, stir together the honey, soy sauce, balsamic vinegar, ginger, garlic and olive oil. Season fish fillets with salt and pepper, and place them into the dish. If the fillets have skin on them, place them skin side down. Cover, and refrigerate for 20 minutes to marinate.', 'Heat vegetable oil in a large skillet over medium-high heat. Remove fish from the dish, and reserve marinade. Fry fish for 4 to 6 minutes on each side, turning only once, until fish flakes easily with a fork. Remove fillets to a serving platter and keep warm.', 'Pour reserved marinade into the skillet, and heat over medium heat until the mixture reduces to a glaze consistently. Spoon glaze over fish, and serve immediately.']"
['Baked Asparagus with Balsamic Butter Sauce'],"['Preheat oven to 400 degrees F (200 degrees C).', 'Arrange the asparagus on a baking sheet. Coat with cooking spray, and season with salt and pepper.', 'Bake asparagus 12 minutes in the preheated oven, or until tender.', 'Melt the butter in a saucepan over medium heat. Remove from heat, and stir in soy sauce and balsamic vinegar. Pour over the baked asparagus to serve.']"
['Chicken Breasts Pierre'],"['In a shallow dish or bowl, combine flour, 1/2 teaspoon salt and ground black pepper. Coat chicken breasts with flour mixture. Melt butter in a large skillet over medium heat, and brown chicken on all sides. Remove from skillet, and drain on paper towels.', 'In the same skillet, combine the tomatoes, water, brown sugar, vinegar and Worcestershire sauce. Season with salt, chili powder, mustard, celery seed, garlic and hot pepper sauce. Bring to a boil; reduce heat, and return chicken to skillet. Cover, and simmer for 35 to 40 minutes, or until chicken is tender, no longer pink and juices run clear.']"
['Refried Beans Without the Refry'],"['Place the onion, rinsed beans, jalapeno, garlic, salt, pepper, and cumin into a slow cooker. Pour in the water and stir to combine.  Cook on High for 8 hours, adding more water as needed.  Note: if more than 1 cup of water has evaporated during cooking, then the temperature is too high.', 'Once the beans have cooked, strain them, and reserve the liquid.  Mash the beans with a potato masher, adding the reserved water as needed to attain desired consistency.']"
['Baked Kale Chips'],"['Preheat an oven to 350 degrees F (175 degrees C). Line a non insulated cookie sheet with parchment paper.', 'With a knife or kitchen shears carefully remove the leaves from the thick stems and tear into bite size pieces. Wash and thoroughly dry kale with a salad spinner. Drizzle kale with olive oil and sprinkle with seasoning salt.', 'Bake until the edges brown but are not burnt, 10 to 15 minutes.']"
['Unbelievable Chicken'],"['In a large glass bowl, mix the cider vinegar, mustard, garlic, lime juice, lemon juice, brown sugar, salt, and pepper. Whisk in the olive oil. Place chicken in the mixture. Cover, and marinate 8 hours, or overnight.', 'Preheat an outdoor grill for high heat.', 'Lightly oil the grill grate. Place chicken on the prepared grill, and cook 6 to 8 minutes per side, until juices run clear. Discard marinade.']"
['Roasted Vegetables'],"['Preheat oven to 475 degrees F (245 degrees C).', 'In a large bowl, combine the squash, red bell peppers, sweet potato, and Yukon Gold potatoes. Separate the red onion quarters into pieces, and add them to the mixture.', 'In a small bowl, stir together thyme, rosemary, olive oil, vinegar, salt, and pepper. Toss with vegetables until they are coated. Spread evenly on a large roasting pan.', 'Roast for 35 to 40 minutes in the preheated oven, stirring every 10 minutes, or until vegetables are cooked through and browned.']"
['Lemon Garlic Tilapia'],"['Preheat oven to 375 degrees F (190 degrees C). Spray a baking dish with non-stick cooking spray.', 'Rinse tilapia fillets under cool water, and pat dry with paper towels.', 'Place fillets in baking dish. Pour lemon juice over fillets, then drizzle butter on top. Sprinkle with garlic, parsley, and pepper.', 'Bake in preheated oven until the fish is white and flakes when pulled apart with a fork, about 30 minutes.']"
['Spaghetti Squash I'],"['Preheat oven to 350 degrees F (175 degrees C). Lightly grease a baking sheet.', 'Place spaghetti squash with cut sides down on the prepared baking sheet, and bake 30 minutes in the preheated oven, or until a sharp knife can be inserted with only a little resistance. Remove squash from oven and set aside to cool enough to be easily handled.', 'Meanwhile, heat oil in a skillet over medium heat. Cook and stir onion in oil until tender. Add garlic; cook and stir until fragrant, 2 to 3 minutes. Stir in tomatoes and cook until tomatoes are warmed through.', 'Use a large spoon to scoop the stringy pulp from the squash and place in a medium bowl. Toss with the vegetables, feta cheese, olives, and basil. Serve warm.']"
['Honey Roasted Red Potatoes'],"['Preheat oven to 375  degrees F (190 degrees C). Lightly coat an 11x7 inch baking dish with nonstick cooking spray.', 'Place potatoes in a single layer in prepared dish, and top with onion. In a small bowl, combine melted butter, honey, mustard, salt and pepper; drizzle over potatoes and onion.', 'Bake in the preheated 375 degrees F (190 degrees C) oven for 35 minutes or until tender, stirring halfway through the cooking time.']"
['Spinach Lentil Soup'],"['In a pot, bring the rice and water to a boil. Reduce heat to low, cover, and simmer 20 minutes.', 'Heat the oil in a large pot over medium heat, and cook the turkey kielbasa until lightly browned. Mix in onion and carrot, and season with red pepper. Cook and stir until tender. Pour in the water and broth, and mix in lentils. Bring to a boil, reduce heat to low, and simmer 25 minutes.', 'Stir the cooked rice and spinach into the soup, and continue cooking 5 minutes before serving.']"
['Mango Corn and Black Bean Salsa'],"['Mix mangoes, sweet corn, and black beans in a large bowl; add lime juice and stir. Sprinkle cilantro over the mango mixture; toss to combine.']"
['Orange Honey and Soy Chicken'],"['Combine chicken, orange juice, soy sauce, honey, garlic paste, ginger paste, and black pepper in a large nonstick skillet over medium-high heat. Cook and stir until the sauce reduces to a sticky glaze and the chicken is cooked through, about 20 minutes.']"
['Meyer Lemon Avocado Toast'],"['Toast bread slices to desired doneness, 3 to 5 minutes.', 'Mash avocado in a bowl; stir in cilantro, Meyer lemon juice, Meyer lemon zest, cayenne pepper, and sea salt. Spread avocado mixture onto toast and top with chia seeds.']"
['Tomato Cucumber Kachumbar'],"['Mix grape tomatoes, cucumber, green onions, cilantro, lemon juice, mint, salt, and pepper together in a large bowl.']"
['Yellow Rice with Vegetables'],"['Heat oil in a saucepan over medium heat. Cook and stir onion, carrot, broccoli, red bell pepper, and garlic in hot oil until garlic just begins to brown, about 5 minutes.', 'Pour vegetable broth into the saucepan; add rice, sazon seasoning, and adobo seasoning and stir. Bring the liquid to a boil, reduce heat to low, and cook until the liquid is absorbed and the rice is tender, about 25 minutes. Fluff rice with a fork to serve.']"
['Paleo Chicken Stew'],"['Heat olive oil in a saucepan over medium-high heat. Saute onion and garlic in hot oil until softened, about 5 minutes.', ""Stir chicken, sweet potatoes, spinach, crushed red pepper, paprika, and sea salt with the onion and garlic in the saucepan. Pour as much chicken broth into the saucepan to make the mixture as soup-like or stew-like as you'd like it."", 'Bring the broth to a boil, reduce heat to medium-low, and simmer until the chicken is no longer pink in the middle and the sweet potatoes are tender, about 30 minutes.']"
['Brandied Cherry Clafouti'],"['Mix cherries, brandy, and 1/3 cup white sugar in a bowl; let soak for 1 hour.', 'Preheat the oven to 450 degrees F (230 degrees C). Spray a 9-inch pie pan with cooking spray.', 'Remove cherries from brandy mixture using a slotted spoon and transfer to the prepared pie pan. Pour brandy mixture into a blender; add remaining 1/3 cup sugar, milk, flour, eggs, vanilla extract, lemon zest, salt, and allspice to the blender. Pulse mixture until batter is smooth; pour over cherries.', ""Bake in the preheated oven for 5 minutes. Reduce heat to 350 degrees F (175 degrees C) and continue baking until golden and puffy, 45 to 50 minutes. Cool slightly and dust with confectioners' sugar to serve.""]"
['Pearl Couscous with Lentils Carrots Spinach and Corn'],"['Heat sesame oil in a large skillet over medium heat; cook and stir onion until it turns translucent, about 5 minutes. Stir in garlic and cook until garlic starts to brown, about 5 to 8 more minutes. Mix in the lentils and cook 3 to 4 minutes to blend flavors, stirring lightly. Stir carrots and corn kernels into the mixture. Reduce heat to low. Pour in 2 tablespoons white wine and 2 tablespoons chicken broth; let the mixture simmer, stirring occasionally.', 'Bring 2 cups chicken broth and 1/4 cup white wine to a boil in a saucepan; stir in couscous and reduce heat to low. Simmer couscous until the liquid has been absorbed and the couscous pearls are tender, about 8 minutes.', 'Stir 2 more tablespoons each of chicken broth and white wine into lentil mixture and lightly toss baby spinach leaves into the vegetables in the skillet until wilted, about 5 minutes.', 'Transfer cooked couscous to a serving bowl and gently stir the spinach-lentil mixture into couscous until thoroughly combined. Drizzle with lemon juice, sprinkle with black pepper, and lightly stir again.']"
['Quinoa and Black Beans'],"['Heat oil in a saucepan over medium heat; cook and stir onion and garlic until lightly browned, about 10 minutes.', 'Mix quinoa into onion mixture and cover with vegetable broth; season with cumin, cayenne pepper, salt, and pepper. Bring the mixture to a boil. Cover, reduce heat, and simmer until quinoa is tender and broth is absorbed, about 20 minutes.', 'Stir frozen corn into the saucepan, and continue to simmer until heated through, about 5 minutes; mix in the black beans and cilantro.']"
['Fluffy French Toast'],"['Measure flour into a large mixing bowl. Slowly whisk in the milk. Whisk in the salt, eggs, cinnamon, vanilla extract and sugar until smooth.', 'Heat a lightly oiled griddle or frying pan over medium heat.', 'Soak bread slices in mixture until saturated. Cook bread on each side until golden brown. Serve hot.']"
"[""Sarah's Applesauce""]","['In a saucepan, combine apples, water, sugar, and cinnamon. Cover, and cook over medium heat for 15 to 20 minutes, or until apples are soft. Allow to cool, then mash with a fork or potato masher.']"
['Refried Beans Without the Refry'],"['Place the onion, rinsed beans, jalapeno, garlic, salt, pepper, and cumin into a slow cooker. Pour in the water and stir to combine.  Cook on High for 8 hours, adding more water as needed.  Note: if more than 1 cup of water has evaporated during cooking, then the temperature is too high.', 'Once the beans have cooked, strain them, and reserve the liquid.  Mash the beans with a potato masher, adding the reserved water as needed to attain desired consistency.']"
['Chocolate Crinkles II'],"['In a medium bowl, mix together cocoa, white sugar, and vegetable oil.  Beat in eggs one at a time, then stir in the vanilla. Combine the flour, baking powder, and salt; stir into the cocoa mixture. Cover dough, and chill for at least 4 hours.', ""Preheat oven to 350 degrees F (175 degrees C). Line cookie sheets with parchment paper. Roll dough into one inch balls. I like to use a number 50 size scoop. Coat each ball in confectioners' sugar before placing onto prepared cookie sheets."", 'Bake in preheated oven for 10 to 12 minutes. Let stand on the cookie sheet for a minute before transferring to wire racks to cool.']"
['Cabbage Fat-Burning Soup'],"['Place carrots, onions, tomatoes, cabbage, green beans, peppers, and celery in a large pot. Add onion soup mix, tomato juice, beef broth, and enough water to cover vegetables. Simmer until vegetables are tender. May be stored in the refrigerator for several days.']"
['Pretzel Turtles'],"['Preheat oven to 300 degrees F (150 degrees C).', 'Arrange the pretzels in a single layer on a parchment lined cookie sheet.  Place one chocolate covered caramel candy on each pretzel.', 'Bake for 4 minutes.  While the candy is warm, press a pecan half onto each candy covered pretzel.  Cool completely before storing in an airtight container.']"
['Slow Cooker Turkey Breast'],"['Rinse the turkey breast and pat dry. Cut off any excess skin, but leave the skin covering the breast. Rub onion soup mix all over outside of the turkey and under the skin. Place in a slow cooker. Cover, and cook on High for 1 hour, then set to Low, and cook for 7 hours.']"
['Red Lentil Curry'],"['Wash the lentils in cold water until the water runs clear. Put lentils in a pot with enough water to cover; bring to a boil, place a cover on the pot, reduce heat to medium-low, and simmer, adding water during cooking as needed to keep covered, until tender, 15 to 20 minutes. Drain.', 'Heat vegetable oil in a large skillet over medium heat; cook and stir onions in hot oil until caramelized, about 20 minutes.', 'Mix curry paste, curry powder, turmeric, cumin, chili powder, salt, sugar, garlic, and ginger together in a large bowl; stir into the onions. Increase heat to high and cook, stirring constantly, until fragrant, 1 to 2 minutes.', 'Stir in the tomato puree, remove from heat and stir into the lentils.']"
"[""Adrienne's Cucumber Salad""]","['Toss together the cucumbers and onion in a large bowl. Combine the vinegar, water and sugar in a saucepan over medium-high heat. Bring to a boil, and pour over the cucumber and onions. Stir in dill, cover, and refrigerate until cold. This can also be eaten at room temperature, but be sure to allow the cucumbers to marinate for at least 1 hour.']"
['Split Pea Soup'],"['In a large stock pot, cover peas with 2 quarts cold water and soak overnight.  If you need a faster method, simmer the peas gently for 2 minutes, and then soak for l hour.', 'Once peas are soaked, add ham bone, onion, salt, pepper and marjoram.  Cover, bring to boil and then simmer for 1 1/2 hours, stirring occasionally.', 'Remove bone; cut off meat, dice and return meat to soup.  Add celery, carrots and potatoes.  Cook slowly, uncovered for 30 to 40 minutes, or until vegetables are tender.']"
['Dumplings'],"['Stir together flour, baking powder, sugar, and salt in medium size bowl. Cut in butter until crumbly. Stir in milk to make a soft dough.', 'Drop by spoonfuls into boiling stew. Cover and simmer 15 minutes without lifting lid. Serve.', 'To make parsley dumplings, add 1 tablespoon parsley flakes to the dry ingredients.']"
['Black Beans and Rice'],"['In a stockpot over medium-high heat, heat the oil. Add the onion and garlic and saute for 4 minutes. Add the rice and saute for 2 minutes.', 'Add the vegetable broth, bring to a boil, cover and lower the heat and cook for 20 minutes. Add the spices and black beans.']"
"[""D's Famous Salsa""]","['Place the tomatoes, onion, garlic, lime juice, salt, green chiles, and cilantro in a blender or food processor. Blend on low to desired consistency.']"
['Mexican Rice III'],"['In a medium sauce pan, cook rice in oil over medium heat for about 3 minutes. Pour in chicken broth, and bring to a boil. Stir in onion, green pepper, jalapeno, and diced tomato. Season with bouillon cube, salt and pepper, cumin, cilantro, and garlic. Bring to a boil, cover, and reduce heat to low. Cook for 20 minutes.']"
['Bean Soup With Kale'],"['In a large pot, heat olive oil. Add garlic and onion; saute until soft. Add kale and saute, stirring, until wilted. Add 3 cups of broth, 2 cups of beans, and all of the tomato, herbs, salt and pepper. Simmer 5 minutes. In a blender or food processor, mix the remaining beans and broth until smooth. Stir into soup to thicken. Simmer 15 minutes. Ladle into bowls; sprinkle with chopped parsley.']"
"[""Beaker's Vegetable Barley Soup""]","['Pour the vegetable broth into a large pot. Add the barley, carrots, celery, tomatoes, zucchini, garbanzo beans, onion, and bay leaves. Season with garlic powder, sugar, salt, pepper, parsley, curry powder, paprika, and Worcestershire sauce. Bring to a boil, then cover and simmer over medium-low heat for 90 minutes. The soup will be very thick. You may adjust by adding more broth or less barley if desired. Remove bay leaves before serving.']"
['Balsamic Bruschetta'],"['In a bowl, toss together the tomatoes, basil, Parmesan cheese, and garlic. Mix in the balsamic vinegar, olive oil, kosher salt, and pepper. Serve on toasted bread slices.']"
['Salsa Chicken Burrito Filling'],"['Place chicken breasts and tomato sauce in a medium saucepan over medium high heat. Bring to a boil, then add the salsa, seasoning, cumin, garlic and chili powder. Let simmer for 15 minutes.', 'With a fork, start pulling the chicken meat apart into thin strings. Keep cooking pulled chicken meat and sauce, covered, for another 5 to 10 minutes. Add hot sauce to taste and stir together (Note: You may need to add a bit of water if the mixture is cooked too high and gets too thick.)']"
"[""Grandma's Slow Cooker Vegetarian Chili""]","['In a slow cooker, combine black bean soup, kidney beans, garbanzo beans, baked beans, tomatoes, corn, onion, bell pepper and celery. Season with garlic, chili powder, parsley, oregano and basil. Cook for at least two hours on High.']"
